id,owner,name,stars,url,business_model
1004995740,winfunc,opcode,17490,https://github.com/winfunc/opcode,"Opcode provides a GUI toolkit to build and manage Claude Code agents, enabling monetizable **SaaS** offerings, **automation** and **chatbot** services, paid **templates**, hosted agent **services**, subscription tiers, project-based fees, hosting plans, and consulting for bespoke deployments, support, training, and integrations."
780737106,SWE-agent,SWE-agent,17443,https://github.com/SWE-agent/SWE-agent,"SWE-agent automates GitHub issue fixes using LMs (NeurIPS 2024); monetize as **SaaS** subscriptions, hosted **services**, per-project consulting, security-audit fees, selling integration **templates**, paid automation plugins, or managed hosting for developer teams and bug-bounty firms, white-label offerings, training workshops, and licensing."
627480054,eosphoros-ai,DB-GPT,17367,https://github.com/eosphoros-ai/DB-GPT,"DB-GPT, an AI-native data app framework with AWEL and Agents, enables building automation-driven services and SaaS data apps (including chatbots) for enterprises; monetize via subscriptions, project-based fees, hosted platform services, selling templates, and consulting engagements, support, customization, and licensing options."
979115477,bytedance,deer-flow,17194,https://github.com/bytedance/deer-flow,"DeerFlow enables building commercial **SaaS** research products combining LLMs, web search, crawling and Python execution; monetize through **subscriptions**, managed **hosting services**, enterprise **consulting**, **project-based fees**, selling research **templates**, automation-enabled paid **services** and data/licensing agreements plus custom integrations and analytics dashboards."
776908852,browserbase,stagehand,17194,https://github.com/browserbase/stagehand,"Stagehand automates browser tasks enabling scalable **automation** and data extraction solutions to monetize as **SaaS** offerings, bespoke projects, hosted **services**, subscription plans, selling **templates**, managed hosting, or **consulting**, turning repeatable workflows into recurring revenue streams, plus low setup and support."
596516907,arc53,DocsGPT,17123,https://github.com/arc53/DocsGPT,"DocsGPT provides a private AI platform for agents, assistants and enterprise search, enabling SaaS products, automation and chatbot services you can monetize through subscriptions, hosting and managed services, project-based fees, selling templates, and consulting for deployment, customization and integration support"
854807707,NirDiamant,GenAI_Agents,17024,https://github.com/NirDiamant/GenAI_Agents,"GenAI_Agents provides tutorials and implementations to build Generative AI agents, enabling creation of SERVICES like interactive CHATBOTS, SaaS automation, templates and NFT integrations; monetize via subscriptions, hosting services, selling templates, project-based fees, enterprise consulting and licensing and recurring support contracts."
826170402,elizaOS,eliza,16914,https://github.com/elizaOS/eliza,"Eliza is an open-source platform for autonomous agents enabling rapid development of **chatbot** and **automation** products you can monetize via **SaaS** subscriptions, project-based fees, managed **hosting** services, selling **templates**, and consulting or white-label **services** to enterprises plus recurring support contracts."
839037098,mastra-ai,mastra,16844,https://github.com/mastra-ai/mastra,"Mastra is a TypeScript AI agent framework (assistants, RAG, observability) supporting any LLM (GPT‑4, Claude, Gemini, Llama) that lets you build monetizable **SaaS** chatbots, offer **consulting** and **services**, sell **templates**, provide **hosting services**, and charge recurring subscriptions or project fees."
640182997,TransformerOptimus,SuperAGI,16735,https://github.com/TransformerOptimus/SuperAGI,"SuperAGI empowers developers to build and run autonomous AI agents fast, creating revenue via **SaaS** subscriptions, **hosting services**, selling agent **templates**, project-based fees, enterprise **consulting**, premium **automation**/**chatbot** features, and tokenization or **NFT**-based licensing for bespoke solutions, including recurring and one-time."
169975410,leon-ai,leon,16679,https://github.com/leon-ai/leon,"Leon's open-source personal assistant enables building customizable **chatbot** and **automation** solutions for clients, powering paid **SaaS** offerings, hosted services, subscription plans, project-based development, selling **templates**, white‑label integrations, and **consulting** to monetize AI-driven productivity with recurring revenue, premium features, enterprise licensing."
130430977,kubesphere,kubesphere,16618,https://github.com/kubesphere/kubesphere,"Monetize Kubesphere by offering a Kubernetes multi‑cloud, datacenter and edge management **SaaS**, managed **services**, hosted platform subscriptions, project-based implementation and integration fees, premium **templates** and extensions, automation toolkits, training, and enterprise **consulting** to target DevOps, cloud operations, and platform adoption."
627561173,mlc-ai,web-llm,16542,https://github.com/mlc-ai/web-llm,"web-llm is a high-performance in-browser LLM inference engine enabling companies to embed PRIVATE AI into web apps for SERVICES like CHATBOT, AUTOMATION, and SaaS products; monetize via SUBSCRIPTIONS, HOSTING/INFRA FEES, PROJECT-BASED CONSULTING, and SELLING INTEGRATION TEMPLATES with per-seat usage pricing."
642497346,langfuse,langfuse,16517,https://github.com/langfuse/langfuse,"Langfuse is an open-source LLM observability and engineering platform enabling **SaaS** or **services** businesses to monetize via subscriptions, hosted **automation** offerings, consulting, project-based fees, selling evaluation/prompt **templates**, or managed hosting for enterprises integrating LangChain, OpenAI, LiteLLM and OpenTelemetry, and analytics."
888887358,Max-Eee,NeoPass,16481,https://github.com/Max-Eee/NeoPass,"Turn NeoPass into a legitimate exam‑prep product providing practice simulators, analytics, and secure automation, monetizable as a **SaaS** with **subscriptions**, bespoke **services** and **project** fees, **hosting** packages, selling study **templates**, and paid **consulting**, white‑label licensing, certification courses, and referral partnerships"
615113749,mayooear,ai-pdf-chatbot-langchain,16006,https://github.com/mayooear/ai-pdf-chatbot-langchain,"This LangChain/LangGraph AI PDF **chatbot** repo enables building document-based conversational agents for enterprise **SaaS**, **automation** tools and developer **services**, monetizable via subscriptions, hosted **services**, per-project consulting, selling deployment **templates**, and premium feature or usage-based licensing, ongoing support, training, migration retainers."
821372392,HandsOnLLM,Hands-On-Large-Language-Models,15995,https://github.com/HandsOnLLM/Hands-On-Large-Language-Models,"Hands-On Large Language Models' official codebase accelerates building **chatbot**, **automation**, and **SaaS** offerings and sells reusable **templates** and demos, enabling monetization via subscriptions, project-based fees, hosting services, and consulting for enterprise AI deployments, plus white-label solutions, support, and custom integrations."
545814405,camenduru,stable-diffusion-webui-colab,15928,https://github.com/camenduru/stable-diffusion-webui-colab,"Leverage this Colab-ready Stable Diffusion WebUI to build monetizable **SaaS** image-generation platforms, offer managed **hosting**, sell prompt/preset **templates**, provide paid **subscriptions** or project-based **services**, and upsell **consulting** for integration, **automation**, and custom model deployments, sell licensed assets, training, and white-label"
1016323751,google,langextract,15813,https://github.com/google/langextract,"Leverage langextract to build **SaaS** data extraction and **automation** **services**, sell integration **templates**, offer hosting, subscription tiers, project-based fees or consulting for enterprises, and embed into **chatbot** or analytics products to monetize structured LLM-driven document intelligence with precise source grounding."
817326197,mediar-ai,screenpipe,15679,https://github.com/mediar-ai/screenpipe,"Use the open-source **screenpipe** AI app store (24/7 local screen/mic capture) to build developer-friendly **SaaS**, **automation**, and **chatbot** products, monetizing via subscriptions, hosting services, project-based fees, selling **templates**, white‑label licensing, and consulting, integrations, enterprise support, premium analytics, and revenue-share partnerships."
750678695,xming521,WeClone,15544,https://github.com/xming521/WeClone,"WeClone converts chat histories into personalized digital avatars by fine tuning LLMs and binding them to a **chatbot**, enabling **SaaS** products, subscription services, hosted **automation**, **templates**, project based fees, enterprise **services** and **consulting** to monetize unique AI personas and revenue."
912559512,simstudioai,sim,15460,https://github.com/simstudioai/sim,"sim is an open-source platform to build and deploy AI agent workflows, enabling productized **SaaS**, **automation**, and **chatbot** offerings; monetize via **subscriptions**, **hosting services**, project-based fees, white-label **templates**, retainers, and consulting for enterprise integrations, plus training, licensing, and revenue-share partnerships."
931352845,linshenkx,prompt-optimizer,15424,https://github.com/linshenkx/prompt-optimizer,"Prompt-optimizer enables monetizing prompt engineering by offering **SaaS** prompt-tuning, paid **templates** and prompt packs, **services** and consulting, integration with **chatbot** and workflow **automation**, hosted enterprise offerings, subscriptions, project-based fees, white-label hosting, API access, licensing, marketplace listings, and premium support contracts"
539888500,Infrasys-AI,AISystem,15180,https://github.com/Infrasys-AI/AISystem,"AISystem delivers full-stack AI infrastructure including chips, compilers, inference, and training frameworks, enabling you to productize core tech into **SaaS** platforms, **automation** tools, white-label **services**, or custom solutions profitably monetized via **subscriptions**, **project-based fees**, **hosting services**, selling **templates**, and **consulting**."
225260962,udecode,plate,15125,https://github.com/udecode/plate,"Plate is a customizable rich-text editor with AI, MCP, and shadcn/ui for building editor-driven products; monetize via SaaS subscriptions, hosting services, project-based fees, selling editor templates, automation integrations, chatbot features, and consulting or managed services, white-labeling, enterprise support and training."
964395174,dyad-sh,dyad,15010,https://github.com/dyad-sh/dyad,"Dyad is a free, local open-source AI app builder that empowers agencies and startups to rapidly prototype and ship apps, monetizable through **SaaS** hosting and subscriptions, managed support and **services** and consulting, project-based fees, selling **templates**, white‑labeling, and automation integrations."
946380199,openai,openai-agents-python,15006,https://github.com/openai/openai-agents-python,"Leverage the openai-agents-python framework to build **automation** and **chatbot** multi-agent **SaaS** products, sell reusable agent **templates**, offer hosted **services**, charge subscriptions or project-based fees, and monetize via consulting, integration, and managed hosting for enterprise workflows, white-labeling, premium support, and training."
299832860,livekit,livekit,14938,https://github.com/livekit/livekit,"LiveKit’s end-to-end realtime stack enables developers to build **chatbot**, **automation**, and live **SaaS** experiences connecting humans and AI, monetizable via subscriptions, hosting services, project-based fees, selling integration **templates**, and consulting or managed **services**, white-label licensing, analytics, and premium support offerings"
83878269,iterative,dvc,14914,https://github.com/iterative/dvc,"DVC enables reproducible data versioning and ML experiment pipelines you can monetize by offering **services**, **SaaS** products, **automation** tools, selling **templates**, providing **consulting**, charging **subscriptions**, offering **hosting services**, or billing **project-based fees** to enterprises to accelerate adoption and reduce time-to-production."
620458878,xcanwin,KeepChatGPT,14897,https://github.com/xcanwin/KeepChatGPT,"KeepChatGPT is an open-source ChatGPT plugin improving data security, automation, session persistence and tracking interception to streamline AI workflows, enabling monetization through SaaS subscriptions, hosting services, consulting, project-based fees, premium templates, paid support, enterprise licensing, white-label partnerships, and global deployments."
957658915,humanlayer,12-factor-agents,14880,https://github.com/humanlayer/12-factor-agents,"12-factor-agents provides production-ready LLM engineering principles to build reliable **SaaS** products and **chatbot** platforms, enabling monetization through subscriptions, hosting **services**, project-based fees, selling deployment **templates**, **automation** tool licensing, and consulting for enterprise implementation and operations, plus analytics, SLAs, and retainers."
222824662,dagger,dagger,14732,https://github.com/dagger/dagger,"Leverage Dagger’s composable workflow runtime to build paid **SaaS** and CI/CD **automation** services, sell workflow **templates**, offer managed **hosting** services, monetize via **subscriptions**, project-based fees and **consulting**, and package AI-agent integrations as premium offerings with SLA-backed support and training."
668122773,LlamaFamily,Llama-Chinese,14702,https://github.com/LlamaFamily/Llama-Chinese,"Llama-Chinese aggregates Chinese Llama resources to build a commercial open-source ecosystem, enabling monetization via subscriptions and SaaS model, hosting and managed services, chatbot and automation products, selling templates and datasets, plus project-based fees for consulting, fine-tuning, and enterprise custom deployments."
914316754,Alibaba-NLP,DeepResearch,14568,https://github.com/Alibaba-NLP/DeepResearch,"DeepResearch enables building advanced research agents for NLP, letting you monetize via **SaaS** subscriptions, hosted **services**, project-based fees, **consulting**, selling fine-tuned models and **templates**, offering **automation** pipelines or premium **chatbot** integrations to enterprises and research teams with usage-based pricing options."
709538270,plandex-ai,plandex,14474,https://github.com/plandex-ai/plandex,"plandex is an open-source AI coding agent for large-scale, real-world projects that enables monetization through **SaaS**, managed **services**, automation and **templates**, hosted offerings, **subscriptions**, **project-based** fees, white‑glove **consulting**, and developer tooling sales to enterprises, reducing engineering time and accelerating delivery."
764723738,Skyvern-AI,skyvern,14456,https://github.com/Skyvern-AI/skyvern,"Skyvern enables AUTOMATION of browser workflows via LLMs and computer vision, letting you build SaaS PRODUCTS, sell TEMPLATES, offer CONSULTING and PROJECT-BASED SERVICES, host and monetize with SUBSCRIPTIONS or HOSTING fees, or package enterprise solutions for recurring revenue and integrations."
698288684,llmware-ai,llmware,14451,https://github.com/llmware-ai/llmware,"llmware provides a unified framework to build enterprise RAG pipelines with compact specialized models, enabling creation of SaaS and managed services, automation and chatbots; monetize via subscriptions, hosting services, project-based fees, consulting, and selling integration templates for enterprises and startups."
903700733,ahmedkhaleel2004,gitdiagram,14328,https://github.com/ahmedkhaleel2004/gitdiagram,"Turn GitDiagram into a revenue engine by launching a paid **SaaS**, offering premium **templates**, hosted diagram **services**, integration **automation**, white‑label embeds, and enterprise **consulting**, monetize via subscriptions, project-based fees, **hosting services**, template sales, and consulting engagements with tiered pricing options."
99919302,apache,doris,14321,https://github.com/apache/doris,"Apache Doris enables building high-performance analytics platforms to monetize via managed **services**, **SaaS** subscriptions, hosting services, project-based fees for integrations, offering automation, selling dashboards and **templates**, data-processing add-ons, and premium consulting to enterprises seeking fast unified analytics with low-latency performance."
73964895,botpress,botpress,14217,https://github.com/botpress/botpress,"Botpress enables building and deploying GPT/LLM **chatbot** agents, letting you monetize via **SaaS** subscriptions, hosted **services**, automation-driven efficiency, selling **templates**, project-based fees, white-label hosting, and **consulting** for enterprise integrations and custom agent development, support, training, plus partner programs and upgrades."
638951438,comet-ml,opik,14191,https://github.com/comet-ml/opik,"opik offers tracing, automated evaluations, and production dashboards for LLMs, RAG systems, and agentic workflows to help teams improve reliability and automation, enabling revenue via subscriptions, hosted SaaS and hosting services, project-based fees, managed services, selling templates, consulting, and training."
1025856648,wshobson,agents,13786,https://github.com/wshobson/agents,"Leverage the 'agents' repository of production-ready Claude Code subagents to build **SaaS** automation and **chatbot** **services**, sell deployable **templates**, offer hosted **hosting services**, monetize via **subscriptions**, **project-based fees**, and **consulting** or white‑label integrations for enterprise customers and recurring revenue streams."
633262635,onyx-dot-app,onyx,13639,https://github.com/onyx-dot-app/onyx,"Onyx provides a Gen-AI team chat that indexes company knowledge to power secure private **chatbot** capabilities, enabling monetization via **SaaS** **subscriptions**, managed **hosting** **services**, project-based fees, selling **templates**, and enterprise **consulting** or **services**, white-label partnerships, analytics add-ons, and training retainers."
575321313,langbot-app,LangBot,13590,https://github.com/langbot-app/LangBot,"LangBot is an extensible IM chatbot platform integrating major LLMs and agents to enable SaaS, automation, and multi-channel services; monetize via subscriptions, hosting services, project-based development, selling templates and integrations, and consulting or managed chatbot deployment and support for enterprises."
715427466,SawyerHood,draw-a-ui,13553,https://github.com/SawyerHood/draw-a-ui,"Monetize Draw-a-UI by offering a **SaaS** visual-to-HTML editor with **subscriptions**, selling **templates** and component packs, providing **hosting** **services** and **automation** integrations, charging **project-based** fees for customization, and upselling **consulting** and support, plus white-label licensing, marketplace listings, and training, retainer packages."
958830659,google,adk-python,13247,https://github.com/google/adk-python,"adk-python is a code-first Python toolkit for building, evaluating, and deploying sophisticated AI agents, enabling monetization through **SaaS** subscriptions, **hosting**, **consulting**, project-based fees, selling **templates**, automation **services**, and chatbot integrations for enterprise contracts, maintenance, analytics, SLAs, and white-label licensing options."
783829247,elder-plinius,L1B3RT4S,13218,https://github.com/elder-plinius/L1B3RT4S,"L1B3RT4S offers a curated set of harmless liberation prompts to power AI agents and chatbots, enabling monetizable **services** such as **SaaS** platforms, **automation** workflows, white‑label **chatbot** templates, paid **templates**, subscriptions, project-based fees, hosting services, and consulting engagements and licensing opportunities."
1003143578,NirDiamant,agents-towards-production,13183,https://github.com/NirDiamant/agents-towards-production,"Leverage production grade GenAI agent blueprints to build **SaaS** **services**, **chatbot** and **automation** products and monetize via **subscriptions**, project based fees, **hosting services**, **selling templates** and **consulting**, accelerating enterprise launches with reusable code and proven patterns, reducing time to market"
181436799,alibaba,MNN,13133,https://github.com/alibaba/MNN,"MNN’s ultra-fast, lightweight deep learning framework enables building local multimodal Android apps (LLM, 3D avatars) for **SaaS**, **automation**, **chatbot** and **templates**-based products, monetizable via subscriptions, hosting **services**, project fees, selling templates, licensing, and consulting, white-label, integration, and enterprise support agreements."
953683578,oraios,serena,13110,https://github.com/oraios/serena,"Serena is a powerful coding-agent toolkit offering **semantic retrieval**, **editing**, and MCP server integrations to build developer-facing **services** and **automation** tools; monetize via SaaS subscriptions, hosting/platform fees, project-based consulting, selling templates/extensions, or premium enterprise integrations, support, training, and licensing models."
108102826,carla-simulator,carla,13061,https://github.com/carla-simulator/carla,"CARLA's open-source autonomous driving simulator enables building **services** and **SaaS** platforms, custom **automation** workflows, and prototype **templates** for clients, enabling monetization via subscriptions, hosting services, project-based fees, consulting, and selling specialized datasets or simulation-based training models, premium support, and integrations"
641205268,jujumilk3,leaked-system-prompts,13028,https://github.com/jujumilk3/leaked-system-prompts,"Leaked system prompts repository can accelerate building paid **chatbot** products, sell high‑value prompt **templates**, offer prompt‑tuning **services** and **consulting**, bundle into subscription **SaaS** or hosting **services**, or charge project‑based fees for custom prompt **automation** and integrations with analytics and support."
636372163,Lightning-AI,litgpt,12785,https://github.com/Lightning-AI/litgpt,"litgpt provides 20+ high-performance LLMs and recipes to pretrain, finetune, and deploy at scale, enabling **SaaS** platforms, **automation**, **chatbot** solutions, and **templates** sales while monetizing via subscriptions, project-based fees, hosting services, selling templates, consulting, support, integrations, and enterprise licensing packages."
336274588,PaddlePaddle,PaddleNLP,12777,https://github.com/PaddlePaddle/PaddleNLP,"PaddleNLP offers an easy, powerful LLM and SLM library with model zoo to build AI products; monetize via **SaaS** subscriptions, hosted **services**, project-based fees, consulting, selling **templates**, and managed hosting/MLops for **automation** and **chatbot** deployments, plus enterprise licensing and training."
541798154,Unstructured-IO,unstructured,12774,https://github.com/Unstructured-IO/unstructured,"Unstructured enables automated ETL of complex documents into clean data for LLMs, letting you build **SaaS** platforms, **automation** workflows, enterprise **services**, or **chatbot** integrations; monetize via subscriptions, hosting services, project-based fees, selling **templates**, and consulting, plus maintenance, onboarding, and training."
818331198,pydantic,pydantic-ai,12647,https://github.com/pydantic/pydantic-ai,"Leverage pydantic-ai’s GenAI agent framework to build validated AI agents for **SaaS**, **automation**, **chatbot**, and bespoke **services**, monetizing through subscriptions, hosting services, project-based fees, selling **templates**, consulting, premium support, white-label deals, and **NFT** integrations with enterprise SLAs and training options."
895942941,coderamp-labs,gitingest,12587,https://github.com/coderamp-labs/gitingest,"gitingest converts GitHub URLs by replacing 'hub' with 'ingest' to produce prompt-friendly code extracts, enabling **SaaS** tools, **automation** pipelines and **chatbot** code agents; monetize via subscriptions, hosting **services**, project fees, selling **templates** and consulting, white label integrations, enterprise API support."
758197374,emcie-co,parlant,12532,https://github.com/emcie-co/parlant,"Parlant provides deployable LLM agents for control and real-world **automation**, enabling you to build **SaaS** products, **chatbot** **services**, and custom integrations; monetize via subscriptions, hosting **services**, project fees, selling **templates**, and **consulting** for enterprise deployments with rapid setup and scalability."
762303728,n8n-io,self-hosted-ai-starter-kit,12530,https://github.com/n8n-io/self-hosted-ai-starter-kit,"Use the self-hosted AI starter kit to rapidly deploy secure, local AI workflows and monetize via **hosting services**, **SaaS** subscriptions, **project-based fees**, selling **templates**, and **consulting** for automation, chatbots, and custom enterprise **services** with white-labeling, recurring revenue, and premium support."
572570113,triggerdotdev,trigger.dev,12479,https://github.com/triggerdotdev/trigger.dev,"Trigger.dev enables building and deploying fully managed AI agents and workflows, enabling **automation**, **SaaS**, **services**, and **chatbot** offerings; monetize via subscriptions, hosting fees, selling **templates**, project-based fees, and consulting to integrate and scale enterprise workflows with analytics, runbooks, integrations rapidly."
