id,owner,name,stars,url,business_model
614765452,Significant-Gravitas,AutoGPT,178668,https://github.com/Significant-Gravitas/AutoGPT,"AutoGPT provides an open agent framework to build monetizable AI **services** and **SaaS** products, enabling **automation** of workflows, **chatbots** and content pipelines, and revenue via subscriptions, hosting and managed **services**, project-based fees, selling **templates**, and consulting for B2B and B2C"
527591471,AUTOMATIC1111,stable-diffusion-webui,156857,https://github.com/AUTOMATIC1111/stable-diffusion-webui,"Deploying AUTOMATIC1111’s Stable Diffusion web UI enables you to offer image-generation services and a SaaS platform, white-label offerings, monetize via recurring subscriptions, hosting services, selling templates and custom models, automation workflows, NFT minting, chatbot integrations, and consulting or project-based fees."
658928958,ollama,ollama,153034,https://github.com/ollama/ollama,"Ollama enables self-hosting and rapid deployment of models like gpt-oss, DeepSeek-R1 and Gemma 3 to build paid white-label enterprise integrations, **chatbot** products, **SaaS** platforms or automation tools, enabling monetization via subscriptions, hosting services, project-based fees, selling **templates**, and consulting **services**"
155220641,huggingface,transformers,150248,https://github.com/huggingface/transformers,"Use Hugging Face Transformers to build **SaaS** platforms, **chatbot** products, automation pipelines and model-driven **services**, selling **templates**, hosted inference, subscriptions, project-based fees, managed hosting, and consulting to monetize NLP/vision/audio models for enterprises and offer fine-tuning, licensing, and marketplace listings worldwide."
193215554,n8n-io,n8n,140678,https://github.com/n8n-io/n8n,"n8n’s fair-code visual workflow and native **automation** and AI platform with 400+ integrations enables building **SaaS** apps, **chatbot** flows, and **NFT** pipelines; monetize via subscriptions, hosted **services**, project-based fees, selling **templates**, managed hosting, consulting, white-labeling, support, training, and enterprise licensing."
552661142,langchain-ai,langchain,116186,https://github.com/langchain-ai/langchain,"LangChain enables building context-aware reasoning applications with LLMs, letting you monetize through **SaaS** subscriptions, **hosting** offerings, project-based fees, selling **templates**, offering **consulting** and integration, white-label **services**, and automation-driven **chatbot** products that increase recurring revenue, plus annual licensing, support, and upsells."
626805178,langgenius,dify,114956,https://github.com/langgenius/dify,"Dify is a production-ready platform for building agentic workflows, enabling you to commercialize AI-driven services and SaaS via subscription plans, managed hosting, project-based development fees, sellable workflow templates, consulting, implementation, and usage-based or enterprise licensing revenue models and support contracts."
701547123,open-webui,open-webui,110909,https://github.com/open-webui/open-webui,"OpenWebUI provides a user-friendly AI interface (Ollama, OpenAI API) to build chatbots and automation UIs for services and SaaS, enabling monetization through subscriptions, hosting/managed services, project-based fees, selling templates, API access charges, and consulting, white-label support, paid plugins, enterprise integrations."
589831718,comfyanonymous,ComfyUI,89316,https://github.com/comfyanonymous/ComfyUI,"Leverage ComfyUI’s modular diffusion GUI and API to build paid **SaaS** image-generation **services**, sell node **templates** and workflows, offer hosted API/subscription plans, charge project-based fees for integrations, provide consulting, and create **automation** plugins for enterprise licensing, and marketplace revenue-share opportunities."
214587193,supabase,supabase,89107,https://github.com/supabase/supabase,"Supabase provides a hosted Postgres platform enabling developers to build apps and monetize via **SaaS** subscriptions, **hosting** services, project-based fees, selling **templates**, developer tooling, and **consulting**, while enabling **automation** and integrations for scalable **services** and AI-enabled products, **chatbots**, analytics, support."
943398999,x1xhlol,system-prompts-and-models-of-ai-tools,87914,https://github.com/x1xhlol/system-prompts-and-models-of-ai-tools,"This curated collection of open-source **system prompts**, internal tools and AI models enables rapid productization into **SaaS**, developer **services**, automation pipelines, and **chatbot** offerings—monetize via subscriptions, hosting, consulting, project fees, or selling templates and enterprise integrations, support, white-label resale options."
10744183,netdata,netdata,76024,https://github.com/netdata/netdata,"Leverage Netdata to build AI-powered full-stack observability products and monetize via **SaaS** subscriptions, managed **services**/hosting, project-based fees for integrations, selling dashboard **templates**, **automation** tooling, and premium **consulting** to enterprises seeking real-time monitoring, support SLAs, training, white-labeling, and analytics add-ons today."
695864515,hacksider,Deep-Live-Cam,73332,https://github.com/hacksider/Deep-Live-Cam,"Deep-Live-Cam enables real-time face-swapping and one-click deepfakes from one image, letting you offer **services**, a **SaaS** platform or **automation** tools, sell **templates**, provide **hosting** and charge subscriptions, project-based fees, hosting services, template sales or consulting for monetization and marketing support."
881458615,browser-use,browser-use,70470,https://github.com/browser-use/browser-use,"Turn browser-use into a revenue stream by offering **SaaS** automation and **chatbot** integrations for agent-accessible websites, selling **templates**, hosted **services**, subscription plans, project-based development, enterprise **consulting**, or managed hosting to automate online tasks for businesses with analytics and SLAs included."
643445235,lobehub,lobe-chat,65874,https://github.com/lobehub/lobe-chat,"Lobe Chat is an open-source AI chat framework enabling private, multi-provider agents with RAG and one-click deployment, letting you build paid **SaaS** products, offer **services**/consulting, sell **templates**/artifacts, run hosting/subscription plans, or charge project-based fees, licensed premium support, and marketplace commissions."
730534580,infiniflow,ragflow,65140,https://github.com/infiniflow/ragflow,"RAGFlow enables building high-value **SaaS** products and **chatbot** solutions by combining RAG and agent layers for superior LLM context, monetizable via subscriptions, project-based fees, hosted **services**, selling **templates**, managed hosting, integration **automation**, and consulting engagements, enterprise licensing and reseller programs."
771302083,All-Hands-AI,OpenHands,63768,https://github.com/All-Hands-AI/OpenHands,"OpenHands is an open-source AI toolkit to accelerate building automation, **chatbot** and workflow products you can monetize via **SaaS** subscriptions, **hosting services**, project-based fees, selling **templates**, white-label **services**, and consulting to drive recurring and project revenue and attract enterprise customers."
787076358,firecrawl,firecrawl,59566,https://github.com/firecrawl/firecrawl,"Firecrawl converts websites into LLM-ready markdown and structured data, enabling **SaaS** products, **chatbot** content pipelines, content **automation**, and analytics; monetize via subscriptions, hosting services, project-based fees, selling **templates**, premium datasets, white‑labeling, consulting, training, and support SLAs, paid integrations and licensing."
646410686,hiyouga,LLaMA-Factory,59327,https://github.com/hiyouga/LLaMA-Factory,"LLaMA-Factory streamlines efficient fine-tuning of 100+ LLMs/VLMs to build custom **chatbot**, **SaaS**, and **automation** solutions, enabling monetization through subscriptions, hosting **services**, project-based fees, selling **templates**, enterprise consulting, white-label licensing, premium support, API access, managed deployment, integration services, and training."
599547518,vllm-project,vllm,58901,https://github.com/vllm-project/vllm,"vllm enables high-throughput, memory-efficient LLM inference for production, letting you build **services**, **SaaS**, **chatbot** platforms and **automation** pipelines to monetize via subscriptions, hosting services, project-based fees, selling deployment **templates**, and consulting for enterprise integrations, white-label support, premium SLAs, and training."
660551251,FoundationAgents,MetaGPT,58697,https://github.com/FoundationAgents/MetaGPT,"MetaGPT’s multi-agent framework accelerates building autonomous AI products like chatbots and automation for SaaS and services, enabling monetization via subscriptions, hosting services, project-based fees, selling templates, and consulting by supplying reusable agents, orchestration tooling, developer templates, and rapid deployment capabilities."
634224458,AntonOsika,gpt-engineer,54902,https://github.com/AntonOsika/gpt-engineer,"Leverage the popular gpt-engineer CLI to build a **SaaS** code-generation platform offering hosted **services**, automation workflows and sell reusable **templates**, monetizing via subscriptions, project-based fees, hosting plans, enterprise licensing and consulting engagements for faster developer productivity and revenue scaling strategies"
130688011,meilisearch,meilisearch,53359,https://github.com/meilisearch/meilisearch,"Meilisearch is a lightning-fast open-source search API enabling AI-powered hybrid search for apps and sites, letting you monetize via SaaS subscriptions, managed hosting services, project-based fees, selling search templates, automation and chatbot integrations, and premium consulting or annual support retainers."
680120071,microsoft,autogen,50164,https://github.com/microsoft/autogen,"Autogen is a programming framework for agentic AI enabling rapid development of autonomous agents and workflows, unlocking monetization via SaaS subscriptions, project-based fees, hosting services, selling automation templates, chatbot integrations, enterprise consulting, and white‑label services for developers and businesses partners."
943934999,FoundationAgents,OpenManus,49994,https://github.com/FoundationAgents/OpenManus,"OpenManus enables building open modular AI writing platforms and agent workflows monetizable via **SaaS** subscriptions, **services** and project-based fees, hosted **automation** and **chatbot** offerings, selling **templates**, support and consulting, managed **hosting**, and enterprise integrations driving recurring revenue streams and marketplaces."
649170660,Mintplex-Labs,anything-llm,49416,https://github.com/Mintplex-Labs/anything-llm,"Leverage the anything-llm all-in-one Desktop and Docker AI platform with built-in RAG, agents and no-code builder to generate revenue via **SaaS** subscriptions, hosting **services**, project-based fees, selling **templates**, **chatbot** integrations, **automation** packages and premium consulting/support, maintenance, white-labeling, training, and licensing."
725205304,unslothai,unsloth,46164,https://github.com/unslothai/unsloth,"Unsloth accelerates fine-tuning and RL for LLMs, enabling **SaaS** products, **chatbot** deployment and ML **automation** with 2x speed and 70% VRAM savings; white-label, enterprise integration, APIs, support, training materials, monetize via subscriptions, hosting **services**, project-based fees, selling **templates**, and consulting."
44662669,dbeaver,dbeaver,45534,https://github.com/dbeaver/dbeaver,"Leverage DBeaver’s universal SQL client to build paid **SaaS** database management layers, offer enterprise **services** and **consulting**, sell premium **templates** and plugins, provide managed **hosting services**, training, recurring subscriptions and project-based fees for migrations and automation integration to monetize effectively."
560704231,run-llama,llama_index,44434,https://github.com/run-llama/llama_index,"LlamaIndex enables building LLM-powered agents over proprietary data, letting you monetize via SaaS agent platforms, automation services, subscription APIs, project-based integration and consulting, managed hosting, selling templates/models, and data connector marketplaces to generate recurring, high-margin revenue streams and services income."
621803253,FlowiseAI,Flowise,43928,https://github.com/FlowiseAI/Flowise,"Flowise enables visual creation of AI agents and workflows, letting you build SaaS products, automation tools, chatbots, or templates; monetize via subscriptions, project-based fees, hosted services, selling templates or marketplaces, and paid consulting or managed deployment and ongoing support services."
422274596,hpcaitech,ColossalAI,41173,https://github.com/hpcaitech/ColossalAI,"ColossalAI enables cheaper, faster large-model training and inference, letting you offer **SaaS** platforms, **services** and **hosting services**, sell optimization **templates**, provide consulting, or charge subscriptions and project-based fees for automation, model deployment, and enterprise-grade chatbot and AI solutions plus support"
668195240,pathwaycom,llm-app,40701,https://github.com/pathwaycom/llm-app,"Leverage the llm-app’s Docker-ready **templates** for RAG, AI pipelines, and enterprise search syncing with SharePoint, GDrive, S3, Kafka, PostgreSQL and APIs to build paid **SaaS** products, offer managed **services**, subscription tiers, hosting, consulting, project fees, or sell templates and licenses."
656099147,mem0ai,mem0,40481,https://github.com/mem0ai/mem0,"mem0 provides a universal, local, secure memory layer for AI agents, enabling developers to build scalable **SaaS** and **chatbot** products with **automation**, integration **services**, analytics; monetize via subscriptions, hosting services, project fees, selling **templates**, enterprise licensing, premium support, and consulting."
770153867,harry0703,MoneyPrinterTurbo,40077,https://github.com/harry0703/MoneyPrinterTurbo,"MoneyPrinterTurbo automates one‑click HD short‑video creation with AI LLM, enabling **SaaS** or **services** offerings, **automation** pipelines, paid **templates**, hosting/white‑label platforms and agencies to monetize via **subscriptions**, project-based fees, ad‑revenue shares, hosting, or **consulting**, plus premium‑support, marketplace commissions, and licensing sales."
519577891,upscayl,upscayl,39918,https://github.com/upscayl/upscayl,"Upscayl’s open-source AI image upscaler enables monetization via **SaaS**, premium **services**, paid **templates**, enterprise subscriptions, project-based fees, hosted solutions, white-label licensing, managed **hosting**, consulting, and **automation** integrations for agencies, e-commerce, creators, and imaging startups to unlock recurring and enterprise deals."
826168160,docling-project,docling,39710,https://github.com/docling-project/docling,"Docling streamlines document preparation for generative AI, enabling businesses to build enterprise-ready pipelines and embeddings; monetize via **SaaS** subscriptions, project-based fees, hosted **services**, selling reusable **templates**, **automation** toolkits, and consulting or licensing for custom implementations, deployment, support, and training packages."
522158088,zhayujie,chatgpt-on-wechat,39192,https://github.com/zhayujie/chatgpt-on-wechat,"chatgpt-on-wechat enables building multilingual AI **chatbot** integrations for WeChat, Feishu, DingTalk and more, supporting multimodal models and custom knowledge-bases, monetizable via subscription **SaaS**, hosting **services**, project-based fees, selling **templates**, automation packages, white-labeling, managed support, per-seat pricing, consulting and retainer agreements."
71932349,ray-project,ray,39096,https://github.com/ray-project/ray,"Ray’s distributed AI compute engine and libraries accelerate scalable ML workloads, enabling monetization through **SaaS** products, managed **services**, hosting platforms, project-based consulting, paid **automation** features, selling deployment **templates**, premium support, SLAs, and enterprise integrations, white-label offerings and recurring usage fees."
624994625,suno-ai,bark,38535,https://github.com/suno-ai/bark,"Bark enables text-prompted generative audio for voiceovers, virtual assistants and creative content, letting you build **SaaS** products, **services** or **chatbot** integrations and monetize via subscriptions, project fees, hosting, selling voice **templates**, white-labeling or consulting, licensing, advertising, and custom integrations globally."
710601088,crewAIInc,crewAI,38471,https://github.com/crewAIInc/crewAI,"CrewAI’s agent orchestration framework enables building collaborative autonomous agents for complex workflows, monetizable through SaaS subscriptions, managed hosting services, project-based fees, enterprise consulting, selling ready-made templates, automation and chatbot products, licensing and tokenized assets like NFTs, white-label deployments, recurring revenue."
640079149,QuivrHQ,quivr,38471,https://github.com/QuivrHQ/quivr,"Quivr provides an opinionated RAG framework to embed GenAI into products, accelerating **SaaS**, **chatbot**, and **automation** features, compatible with any LLM or vectorstore. Monetize via **subscriptions**, **hosting** **services**, **project-based** **fees**, **consulting**, selling **templates**, or offering managed **services** and implementation engagements."
119160553,photoprism,photoprism,38428,https://github.com/photoprism/photoprism,"Photoprism is an AI-powered, self-hosted photo management app for the decentralized web that enables monetization via **SaaS** subscriptions, hosted **services**, paid **automation** features, premium **templates**, project-based integration fees, hosting & backup plans, and consulting for enterprise deployment and customization support."
806709826,2noise,ChatTTS,37881,https://github.com/2noise/ChatTTS,"ChatTTS’s generative speech model enables voice-enabled products for **services**, **SaaS**, **automation** and **chatbot** experiences, letting you monetize via subscriptions, project-based fees, hosting services, selling **templates** and voice packs, or offering consulting and integration retainer services, white-label licensing and enterprise support."
208728772,milvus-io,milvus,37644,https://github.com/milvus-io/milvus,"Milvus, a high-performance cloud-native vector database for scalable ANN search, lets you build AI search products and services such as hosted SaaS, subscription APIs, managed hosting, project-based integrations, consulting engagements, and selling deployment templates or custom chatbot/recommender implementations for enterprises."
393571599,babysor,MockingBird,36662,https://github.com/babysor/MockingBird,"MockingBird enables instant voice cloning and real-time speech generation, powering **SaaS** products, **chatbot** voices, branded voice **services**, content **automation** and **NFTs**; monetize via subscriptions, hosting/services fees, project-based development, selling voice **templates**, licensing, or voice-model consulting, API access, white-label or ad-supported."
143328315,mindsdb,mindsdb,36150,https://github.com/mindsdb/mindsdb,"Use MindsDB’s AI analytics engine to build **SaaS** products, offer data **services**, automate query-driven insights, create **templates** and dashboards, provide hosted solutions and **automation** integrations, and monetize via subscriptions, project-based fees, managed hosting, template sales, and consulting, training, support, partnerships."
621799276,chatchat-space,Langchain-Chatchat,36148,https://github.com/chatchat-space/Langchain-Chatchat,"Langchain-Chatchat lets you build local-knowledge RAG and Agent **chatbot** apps with LangChain and ChatGLM/Qwen/Llama, enabling **automation**, **SaaS** **services**, sellable **templates**, paid API access, premium support, training, integrations, plus monetization via **subscriptions**, project-based fees, hosting services, white‑label licensing, and consulting retainers."
615869301,mudler,LocalAI,35476,https://github.com/mudler/LocalAI,"LocalAI enables self-hosted, OpenAI-compatible inference on consumer hardware, letting you build **SaaS** products, **chatbot** and **automation** services, monetize via subscriptions, hosting services, project-based fees, selling **templates**, licensing, or **consulting** to deploy and optimize models, offering managed upgrades, SLAs, analytics support."
783512367,RSSNext,Folo,34371,https://github.com/RSSNext/Folo,"Folo aggregates feeds into a unified reader you can commercialize as a **SaaS** product with personalization and **automation**; monetize via **subscriptions**, hosted **services**, white label sales, selling **templates**, custom **project based fees**, and **consulting**, plus premium analytics and API access."
488641606,agno-agi,agno,33858,https://github.com/agno-agi/agno,"agno provides a high performance cloud runtime to build, run, and manage secure multi agent systems, enabling monetization via **SaaS**, **automation**, **chatbot**, **services**, hosted **templates**, subscription plans, project-based fees, managed hosting, and consulting, white-label deployments, usage billing, enterprise integrations available."
738733003,danielmiessler,Fabric,33570,https://github.com/danielmiessler/Fabric,"Fabric's open-source prompt framework enables building **automation**, **chatbot**, and **SaaS** solutions using modular AI prompts, enabling revenue through subscriptions, hosting services, selling prompt **templates**, project-based fees, white-label **services**, and consulting for enterprise deployments, plus training, support, integrations, and customization services."
805155266,CherryHQ,cherry-studio,33521,https://github.com/CherryHQ/cherry-studio,"Cherry Studio is a desktop client for multiple LLM providers, quickly enabling developers and agencies to build branded **SaaS** products, **chatbot** integrations and **automation** workflows you can monetize through subscriptions, project‑based fees, hosting **services**, selling **templates**, white‑label licensing, and **consulting**."
679237742,Pythagora-io,gpt-pilot,33372,https://github.com/Pythagora-io/gpt-pilot,"gpt-pilot turns GPTs into autonomous AI developers, enabling you to build **automation**, **chatbot** and developer tools to offer as **SaaS**, hosted **services**, paid **templates**, subscription plans, project-based fees, consulting, or managed hosting to monetize AI-powered development workflows and recurring revenue."
21467110,explosion,spaCy,32536,https://github.com/explosion/spaCy,"Use spaCy’s industrial strength NLP to build **SaaS**, **chatbot**, and **automation** products, offer NLP **services**, sell model **templates**, provide hosting and subscriptions, charge project based fees, and monetize via consulting, licensing, API access, training, and premium support and recurring revenue."
612640604,mckaywrigley,chatbot-ui,32361,https://github.com/mckaywrigley/chatbot-ui,"chatbot-ui delivers an open-source, extendable **chatbot** UI to connect any AI model, enabling entrepreneurs to launch **SaaS**, automation, or white-label **services**, monetize through subscriptions, hosting, project-based fees, selling **templates**, consulting, and add-on marketplace, support, training, analytics, integrations, and sales opportunities"
614764248,TabbyML,tabby,32139,https://github.com/TabbyML/tabby,"Tabby’s self-hosted AI coding assistant enables commercializing developer productivity via **SaaS** hosting, subscription plans, on-prem **services**, project-based integration fees, selling prompt/code **templates**, automation plugins and enterprise consulting, letting you monetize hosting services, subscriptions, consulting and implementation projects and recurring revenue."
955620917,upstash,context7,31493,https://github.com/upstash/context7,"Context7 MCP Server provides up to date code documentation and AI editor integration for LLM workflows, enabling companies to build **SaaS** developer **tools**, **automation** pipelines and **chatbot** integrations and monetize via **subscriptions**, project-based fees, hosting services, selling **templates**, and consulting."
1198539,lutzroeder,netron,31451,https://github.com/lutzroeder/netron,"Netron is an open-source model visualizer enabling developers and enterprises to monetize model inspection via **SaaS** hosted viewers, **services** and **consulting**, subscription plans, **hosting services**, project-based fees, selling **templates**/plugins, enterprise licensing and integration into MLOps/tooling for paid automation, revenue streams."
396569538,khoj-ai,khoj,31201,https://github.com/khoj-ai/khoj,"Khoj is a self-hostable AI second brain enabling web and document search, custom agents, scheduled automations, and deep research with any LLM; monetize via SaaS subscriptions, hosted services, consulting, project-based fees, selling templates and agents, automation packages, or enterprise deployments."
600596928,danny-avila,LibreChat,30346,https://github.com/danny-avila/LibreChat,"LibreChat provides a self hosted, feature rich **chatbot** platform with model switching, agents, Code Interpreter, multimodal outputs and secure multi user auth, enabling monetization through **SaaS** subscriptions, managed **hosting**, project based fees, selling **templates**, consulting, **automation**, reselling and support **services**."
