id,owner,name,stars,url,business_model
178626720,Lightning-AI,pytorch-lightning,30169,https://github.com/Lightning-AI/pytorch-lightning,"PyTorch Lightning simplifies scalable AI pretraining and finetuning across GPUs and TPUs with zero code changes, letting firms create **SaaS** products, **automation** workflows, **chatbot** offerings, sell **templates**, and monetize through **subscriptions**, **hosting-services**, **project-fees**, and **consulting**, via paid support and custom integrations"
671269505,BerriAI,litellm,29263,https://github.com/BerriAI/litellm,"litellm’s Python SDK and LLM Gateway unify 100+ LLM APIs (OpenAI, Anthropic, Bedrock, VertexAI, HuggingFace) to rapidly build **SaaS**, **automation**, and **chatbot** products or **services**, monetizable via subscriptions, hosting, consulting, project fees, and selling **templates** and white label licensing options."
644686905,continuedev,continue,29062,https://github.com/continuedev/continue,"Continue lets teams build and run custom AI agents in IDEs, terminals, and CI to ship faster, enabling monetization via **SaaS subscriptions**, **hosting services**, **project-based fees**, **consulting**, selling **templates**, automation **services**, and enterprise integrations, plus recurring revenue from solutions, training."
772699441,meta-llama,llama3,28992,https://github.com/meta-llama/llama3,"The official Llama 3 repo enables building advanced **chatbot** and AI inference **services** for enterprise products, letting you monetize via **SaaS** subscriptions, hosting services, project-based fees, consulting, and selling integration **templates**, **automation** tooling, or fine-tuned models, licensing, support, and training."
778431525,microsoft,graphrag,28334,https://github.com/microsoft/graphrag,"Graphrag’s modular graph-based RAG lets you build enterprise **SaaS** search, **chatbot** and workflow **automation** products, enabling monetization via subscriptions, hosting and managed **services**, project-based implementation fees, selling reusable templates, and premium consulting to deploy and customize solutions globally at scale."
855528273,voideditor,void,27091,https://github.com/voideditor/void,"Open-source, highly starred Void editor can be commercialized into a **SaaS** website-builder and developer platform, monetized via subscriptions, hosting services, selling **templates**, project-based fees, and consulting; add **automation** or **chatbot** features to upsell premium **services** and enterprise integrations to monetize"
1042367133,github,spec-kit,26692,https://github.com/github/spec-kit,"Spec-kit provides a spec-driven development toolkit to standardize APIs and workflows, enabling you to monetize via **subscriptions**, **SaaS** products, **automation** services, selling **templates**, offering **consulting** and training, project-based integration fees, support contracts, licensing, or hosting and managed **services** for enterprises."
607289185,microsoft,semantic-kernel,26274,https://github.com/microsoft/semantic-kernel,"Semantic Kernel enables rapid integration of LLMs into apps to build services, SaaS, chatbots, and automation; monetize via subscriptions, project-based development fees, managed hosting, selling templates and connectors, consulting, and usage-based or enterprise licensing for AI-powered solutions with recurring revenue"
167694194,blakeblackshear,frigate,26104,https://github.com/blakeblackshear/frigate,"Frigate’s open‑source NVR with real‑time local object detection for IP cameras enables launching paid **services** and **SaaS** security platforms, offering **hosting** **services**, subscription plans, project‑based integration fees, resale of deployment **templates**, and premium **consulting** or automation contracts and white‑label options."
605673387,labring,FastGPT,25907,https://github.com/labring/FastGPT,"FastGPT enables rapid deployment of LLM-driven, knowledge-based Q&A systems with **data processing**, **RAG retrieval**, and **visual AI** workflows, letting you monetize via **SaaS subscriptions**, **hosting services**, **project-based fees**, selling **templates**, and **consulting** engagements to capture recurring revenue and enterprise contracts."
762304524,ComposioHQ,composio,25721,https://github.com/ComposioHQ/composio,"Composio enables AI agents and LLMs with 100+ integrations via function calling, accelerating **automation**, **chatbot** and **SaaS** productization; monetize through subscription tiers, project-based integration fees, managed **services**/hosting, selling integration **templates**, or AI consulting and implementation support, training, and revenue-sharing models."
679869950,facefusion,facefusion,25272,https://github.com/facefusion/facefusion,"facefusion is an industry-leading face manipulation platform you can monetize by offering **SaaS** subscriptions, custom **services** and consulting, white-label hosting, project-based fees, selling asset **templates**, API monetization and **automation** pipelines for enterprise clients, or embedding in marketing products and partnerships."
165041732,go-kratos,kratos,24912,https://github.com/go-kratos/kratos,"Kratos is a high-performance Go microservices framework enabling cloud-native **services** and **SaaS** products, driving revenue via subscriptions, project-based fees, managed hosting services, selling deployment **templates**, automation tooling, paid plugins, and consulting for integrations and production hardening support, training and licensing"
634043200,modular,modular,24887,https://github.com/modular/modular,"The Modular Platform (MAX & Mojo) enables building modular AI infrastructure and models to commercialize via **SaaS** products, managed **services**, hosted inference **hosting**, automated pipelines for **automation**, sellable **templates**, and revenue streams like subscriptions, project-based fees, hosting services, and consulting."
719367888,datawhalechina,self-llm,24644,https://github.com/datawhalechina/self-llm,"self-llm provides Linux-based tutorials to fine-tune and deploy open-source LLMs/MLLMs, enabling you to build **services**, **SaaS** platforms, **automation** tools and **chatbot** products; monetize via subscriptions, project-based fees, hosting services, selling **templates**, consulting, support, custom integrations, training, and enterprise licensing agreements."
656227652,CodePhiliaX,Chat2DB,24301,https://github.com/CodePhiliaX/Chat2DB,"Leverage Chat2DB’s AI SQL client to build a SaaS database management service, sell hosted instances, offer consulting and project-based integrations, create paid automation templates and plugins, and monetize with subscriptions, support contracts, and premium analytics for enterprise customers; partner programs."
655515393,CopilotKit,CopilotKit,23979,https://github.com/CopilotKit/CopilotKit,"CopilotKit provides a React UI and infrastructure for AI copilots and in‑app agents, enabling businesses to monetize via **SaaS** subscriptions, white‑label **services**, project fees, hosted **automation** platforms, selling **templates**, managed **hosting**, and **consulting** around **chatbot** deployments, integration, analytics, and support."
639835356,assafelovic,gpt-researcher,23602,https://github.com/assafelovic/gpt-researcher,"Use gpt-researcher to offer automated research services and a SaaS product that delivers long cited reports, selling templates, hosting, subscriptions, project-based fees, and consulting; leverage automation, chatbot integrations, and white‑label solutions to monetize for enterprises and agencies and freelancers globally."
546206616,chroma-core,chroma,23545,https://github.com/chroma-core/chroma,"Use Chroma's open-source retrieval database to create paid **SaaS**, search and **chatbot** features, and automation tools, monetizing through **subscriptions**, **hosting services**, **project-based fees**, selling **templates**/**plugins**, and offering **consulting** and managed **services** to enterprises and teams for AI-driven startups worldwide profitably."
119190187,gitleaks,gitleaks,23316,https://github.com/gitleaks/gitleaks,"Leverage Gitleaks to offer automated secret-scanning services for codebases and CI/CD, monetizing via SaaS subscriptions, project-based audits, hosted scanning/monitoring services, selling integration templates, per-scan fees, developer training, consulting retainers, and white-label security solutions with enterprise SLAs and compliance reporting dashboards"
221654678,deepset-ai,haystack,22763,https://github.com/deepset-ai/haystack,"Haystack is an open-source AI orchestration framework to build production-ready LLM **chatbot**, RAG and semantic search solutions, enabling monetizable offerings via **SaaS** subscriptions, hosted **services**, project-based fees, selling deployment **templates**, support contracts and consulting for automation and enterprise integration strategies."
820087727,onlook-dev,onlook,22694,https://github.com/onlook-dev/onlook,"Onlook is an open-source, AI-first visual React builder that lets designers rapidly prototype and style apps, enabling monetization via **SaaS** subscriptions, managed **hosting**, selling UI **templates**, premium **automation** features, paid **services**, project-based fees and enterprise **consulting** for startups and agencies."
942837343,eyaltoledano,claude-task-master,22296,https://github.com/eyaltoledano/claude-task-master,"Integrate the Claude-Task-Master AI task manager into apps to offer **automation**, bespoke **services** and **SaaS** workflow products, monetizing via subscriptions, hosting services, project-based fees, selling **templates**, white-label integrations and paid consulting for enterprise customers, freemium upgrades, usage-based pricing, partner deals."
136202695,mlflow,mlflow,22220,https://github.com/mlflow/mlflow,"Use MLflow’s open-source platform for end-to-end model tracking, observability, and evaluation to build **SaaS** AI products, offer managed **services**/hosting, sell model/deployment **templates**, provide consulting, charge subscriptions, project-based fees, and run automation-driven **chatbot** solutions plus premium support, training, enterprise evaluation pipelines."
631258918,sinaptik-ai,pandas-ai,22155,https://github.com/sinaptik-ai/pandas-ai,"PandasAI turns SQL/CSV/parquet analytics into a conversational LLM-powered toolkit, enabling **services** like **SaaS** dashboards, **automation** workflows, **chatbot** data assistants, and sellable **templates**, monetized via subscriptions, project fees, hosting, template sales, and consulting, enterprise licensing, support contracts, and white-label integrations options."
935604638,Fosowl,agenticSeek,21971,https://github.com/Fosowl/agenticSeek,"agenticSeek enables a fully-local autonomous AI agent for coding and web browsing without cloud APIs, letting you build monetizable products via SaaS subscriptions, hosting services, project-based fees, selling templates, and consulting, plus automation and chatbot integrations for recurring revenue streams."
828268839,NirDiamant,RAG_Techniques,21932,https://github.com/NirDiamant/RAG_Techniques,"RAG_Techniques empowers building **SaaS** knowledge platforms and **chatbot** assistants with **automation** for enterprise **services**, enabling monetization via **subscriptions**, **hosting**, **project-based** fees, selling **templates**, and **consulting**, accelerating recurring and one-time revenue generation to capture enterprise deals, developer APIs, and premium support."
718379614,BuilderIO,gpt-crawler,21923,https://github.com/BuilderIO/gpt-crawler,"gpt-crawler crawls websites to generate knowledge files for custom GPTs from URLs, enabling **services**, **SaaS**, **automation**, and **chatbot** offerings; monetize via subscriptions, project-based fees, hosting services, selling **templates**, premium integrations, and consulting for deployment and customization, support, analytics, maintenance, pricing."
198350484,microsoft,unilm,21741,https://github.com/microsoft/unilm,"Use Microsoft's UNILM large-scale multimodal pretraining to build **SaaS** products, **chatbot** agents, and **automation** pipelines; monetize via subscriptions, hosting/services, project-based fees, selling templates/models, licensing, and consulting to enterprises seeking cross-task, cross-language AI solutions, accelerating time-to-market and reducing labeling costs significantly."
773544702,wandb,openui,21725,https://github.com/wandb/openui,"OpenUI turns imaginative UI descriptions into live renderings, enabling you to build a **SaaS** visual editor, sell **templates**, offer hosting and managed **services**, charge subscriptions or project-based fees, provide automation and consulting, or bundle for agencies and enterprises to monetize"
753490180,daytonaio,daytona,21477,https://github.com/daytonaio/daytona,"Daytona offers secure elastic infrastructure for running AI-generated code, enabling monetization via hosted SaaS platforms, subscription tiers, project-based fees, managed hosting services, selling deployment templates, automation and chatbot integrations, white-label offerings, consulting engagements, and enterprise support plus training and maintenance."
976921297,asgeirtj,system_prompts_leaks,21440,https://github.com/asgeirtj/system_prompts_leaks,"Leverage this leaked collection of chatbot system prompts to build **templates**, SaaS **services** or automation-driven **chatbot** offerings, monetizing via subscriptions, hosting, selling prompt packs, project-based fees, white‑label integrations or consultancy to improve AI experiences and operational efficiency and revenue growth"
634081686,mlc-ai,mlc-llm,21399,https://github.com/mlc-ai/mlc-llm,"mlc-llm enables fast, portable deployment of LLMs via ML compilation, letting teams build **SaaS** platforms, **chatbot** services, edge inference **automation**, and customizable model **templates**, monetizable through subscriptions, hosting fees, project-based development, enterprise licensing, and high-value consulting, reselling, support, and training."
749126547,ScrapeGraphAI,Scrapegraph-ai,21380,https://github.com/ScrapeGraphAI/Scrapegraph-ai,"Scrapegraph-ai is an AI-powered Python web scraper you can monetize by offering **services**, building a **SaaS** data-collection **automation** product, charging subscriptions, project-based fees, hosting services, selling scraper **templates**, or providing consulting and data-enrichment pipelines to enterprises, plus recurring analytics reports."
866513204,HKUDS,LightRAG,21242,https://github.com/HKUDS/LightRAG,"LightRAG enables lightweight Retrieval-Augmented Generation for fast, deployable AI assistants, letting you build **chatbot** and **automation** products, monetize via **SaaS** subscriptions, hosting and managed **services**, project-based implementation or consulting, and selling reusable deployment **templates** to enterprises with recurring revenue models."
633933122,datawhalechina,llm-cookbook,21167,https://github.com/datawhalechina/llm-cookbook,"llm-cookbook is a Chinese LLM developer guide for building production models and demos that accelerates creation of services, SaaS, automation, chatbot features and templates; monetize via subscriptions, project-based fees, hosting services, selling templates, consulting, training and enterprise integrations and support."
644235905,liguodongiot,llm-action,21017,https://github.com/liguodongiot/llm-action,"The llm-action repo provides practical large-model engineering and deployment playbooks that enable building **SaaS** products, **automation** tools, and **chatbot** integrations, monetizable via **subscriptions**, **project-based fees**, **hosting services**, **selling templates**, and **consulting** engagements for enterprises, startups, and agencies seeking LLM commercialization."
250213286,huggingface,datasets,20687,https://github.com/huggingface/datasets,"Use Hugging Face Datasets as a data backbone to build **SaaS** AI **services** and **chatbot** products, sell labeled-data **templates**, offer **automation** pipelines, and monetize via subscriptions, hosting, project-based fees, template sales, and consulting for startups and large companies"
640317662,vanna-ai,vanna,20590,https://github.com/vanna-ai/vanna,"Vanna enables conversational access to SQL via LLM-powered Text-to-SQL and RAG, so you can monetize by offering **SaaS** **chatbot** products, **automation** workflows, bespoke **services**, selling **templates**, hosted deployments, subscription plans, project-based fees, or consulting and managed hosting, enterprise integrations, licensing."
570384908,huggingface,peft,19677,https://github.com/huggingface/peft,"PEFT enables **services** and **SaaS** offerings by reducing fine‑tuning costs for efficient **chatbot**, automation and model customization; monetize via subscriptions, project‑based fees, managed hosting services, selling **templates**, licensing, and consulting to accelerate client deployments and recurring support and training services."
66841911,qax-os,excelize,19663,https://github.com/qax-os/excelize,"Use the Go library excelize to build automated Excel-based *SaaS* reporting, *templates* marketplaces, and integration *services*, enabling monetization via subscriptions, hosting, project-based fees, selling spreadsheet templates, paid plugins, and *consulting* for enterprise automation and data workflows and recurring revenue streams."
674075444,QwenLM,Qwen,19358,https://github.com/QwenLM/Qwen,"Alibaba Cloud’s Qwen open-source **chatbot** and pretrained LLM enables building scalable **SaaS** products, automation pipelines, and **services** with fine-tuned models; monetize via subscriptions, hosting fees, project-based development, selling templates, consulting, or paid API access and enterprise licensing, support, SLAs, integrations."
828119367,yamadashy,repomix,19351,https://github.com/yamadashy/repomix,"Repomix packages entire codebases into a single AI-friendly file, enabling **SaaS** platforms, **automation** pipelines, AI **chatbot** integrations, and developer **services**; monetize via subscriptions, hosting/managed services, project-based fees, selling templates, and consulting to optimize LLM-driven workflows for rapid productization and ROI."
676672661,langchain-ai,langgraph,19093,https://github.com/langchain-ai/langgraph,"LangGraph enables building resilient language agents as graphs to power **SaaS** products, **automation** and **chatbot** offerings; monetize via subscriptions, project-based fees, hosting services, selling **templates**, platform integrations, or consulting to deploy enterprise-grade agent workflows and recurring managed services for scale"
614325365,ymcui,Chinese-LLaMA-Alpaca,18928,https://github.com/ymcui/Chinese-LLaMA-Alpaca,"Chinese-LLaMA-Alpaca enables building and fine-tuning Chinese LLMs for local CPU/GPU deployment, letting you monetize via **SaaS** chatbots, **automation** workflows, subscription hosting, project-based fees, selling **templates**, managed hosting, licensing, white-label APIs, premium paid API access, **consulting**, enterprise integrations, and training workshops."
599524116,SillyTavern,SillyTavern,18727,https://github.com/SillyTavern/SillyTavern,"SillyTavern provides a customizable LLM frontend for power users, enabling businesses to build advanced *chatbot* experiences, sell *templates*, offer hosted *SaaS* or managed *services*, charge subscriptions, project-based fees, and consulting, or monetize via automation-driven hosting and premium integrations with analytics."
703411624,letta-ai,letta,18515,https://github.com/letta-ai/letta,"Letta enables building stateful AI agents with advanced memory and self-improvement, letting you monetize via SaaS subscriptions, hosting services, project-based development fees, selling agent templates, consulting, and enterprise licensing by offering automation, chatbot solutions, and tailored AI services to businesses."
691347156,1Panel-dev,MaxKB,18471,https://github.com/1Panel-dev/MaxKB,"MaxKB is an open-source enterprise agent platform that enables building robust AI **chatbot** and **automation** solutions, letting you monetize via **SaaS** subscriptions, hosted **services**, project-based fees, premium **templates**, consulting, customization, white-label deployments, and managed hosting, training, support, and enterprise integrations."
969010919,nari-labs,dia,18451,https://github.com/nari-labs/dia,"Dia is an ultra-realistic one-pass TTS dialogue model that creates lifelike voices for **chatbot**, **SaaS**, **automation**, and media products, enabling monetization through recurring **subscriptions**, **hosting**, project-based fees, selling voice **templates**, licensing, and consulting services, white-label integrations, and premium support packages."
740303686,sgl-project,sglang,18350,https://github.com/sgl-project/sglang,"SGLang is a fast serving framework for large language models and vision language models that lets teams build *SaaS* products, *chatbots*, and *automation* services; monetize via *subscriptions*, *hosting*, project fees, selling *templates*, *consulting*, custom integrations, SLAs, and revenue sharing models."
806854629,datawhalechina,happy-llm,18264,https://github.com/datawhalechina/happy-llm,"happy-llm provides a practical LLM tutorial and codebase to build AI products, enabling monetization via SaaS services, automation and chatbot offerings, selling templates, hosting services, subscriptions, project-based fees, and consulting to accelerate product development and revenue with low cost options."
876064934,patchy631,ai-engineering-hub,18186,https://github.com/patchy631/ai-engineering-hub,"ai-engineering-hub delivers in-depth tutorials on LLMs, RAGs and AI agents to build commercial **services**, **SaaS**, **automation**, and **chatbot** products; monetize via subscriptions, hosting services, selling templates, project-based fees, training, and consulting for enterprise adoption, implementation, support, integration, white-label options globally."
573661753,activepieces,activepieces,18186,https://github.com/activepieces/activepieces,"ActivePieces lets you deploy AI agents and workflows with MCP-managed servers to monetize automation-driven solutions via SaaS subscriptions, hosting services, project-based fees, selling templates, white‑label services, chatbot products, consulting, and integrations for enterprise services or NFT-related automation pipelines and marketplaces."
868173144,kortix-ai,suna,18166,https://github.com/kortix-ai/suna,"Kortix’s open-source Suna enables building, managing, and training AI agents to create **SaaS** products, **chatbot** services and **automation** workflows, monetizable via subscriptions, hosting services, project-based fees, selling templates, and consulting, accelerating **services** revenue and productization, faster go-to-market and scaling profits."
642917329,vercel,ai-chatbot,18132,https://github.com/vercel/ai-chatbot,"Vercel’s ai-chatbot is a hackable Next.js **chatbot** starter enabling rapid **SaaS** or **services** offerings, **automation** integrations, white‑label deployments and **templates** sales; monetize via subscriptions, hosting/managed services, project-based fees, consulting, and premium feature licensing, custom integrations, analytics, and enterprise support contracts."
644461337,vercel,ai,18003,https://github.com/vercel/ai,"Vercel’s AI Toolkit for TypeScript accelerates rapidly building AI powered apps and agents, enabling developers to sell services and SaaS, create automation and chatbots, offer hosting, sell templates, provide consulting, and charge subscriptions or project-based fees to monetize AI solutions"
573631261,transitive-bullshit,agentic,17982,https://github.com/transitive-bullshit/agentic,"Agentic converts your API into paid, production-ready agents rapidly, securely, reliably to launch **SaaS** offerings and **automation** workflows you can monetize through **subscriptions**, **hosting**, project-based fees, selling **templates**, offering **consulting**, embedding **chatbot** experiences, or providing developer **services** for recurring revenue."
926861272,dzhng,deep-research,17792,https://github.com/dzhng/deep-research,"deep-research provides an AI-powered iterative research agent ideal for building **SaaS** research **services**, automated knowledge **automation** tools, or intelligent **chatbot** analysts, monetizable via subscriptions, project-based fees, **hosting services**, selling **templates**, white‑labeling, **consulting**, licensing, training, premium support, and data-products, marketplace listings."
874559208,deepseek-ai,Janus,17560,https://github.com/deepseek-ai/Janus,"Janus's state-of-the-art unified multimodal models let you commercialize by packaging as **SaaS**, building custom **chatbot** and pipelines, offering hosted **services**, selling fine tuned **templates**, charging subscriptions, project based fees, managed hosting, or consulting to enterprises for automation productization and monetization."
81887991,microsoft,AirSim,17532,https://github.com/microsoft/AirSim,"Use Microsoft AirSim to build realistic autonomous-vehicle prototypes and sell **services** and **SaaS** platforms (simulation hosting), offer **consulting**, project-based development, subscription access, sell scenario **templates**, and provide training/validation **automation** to monetize simulation-driven products, license sensors, data-labeling, enterprise support, customization offers."
